{
  "doc_id": "BGR-GMB-2021-001",
  "title": "Sustainable Mining and Climate Resilience: A Global Review",
  "authors": ["Schmidt, Hans", "Mueller, Klaus", "Weber, Johannes"],
  "year": 2021,
  "language": "en",
  "topic": "mining_governance",
  "region": "Global, with focus on Sub-Saharan Africa",
  "document_type": "report",
  "pages": 186,
  "isbn": "978-3-942315-42-1",
  "series": "German Technical Cooperation Reports",
  "issue_number": "GMB-2021-001",
  "abstract": "This comprehensive report examines sustainable mining practices and their integration with climate resilience strategies. Drawing from case studies across 15 developing nations, the analysis demonstrates how geological assessments can inform climate adaptation planning and reduce environmental impacts from extractive industries. The report provides evidence-based recommendations for policymakers on integrating mining governance with climate action frameworks (SDG 13).",
  "keywords": ["sustainable mining", "climate resilience", "mining governance", "SDG 12", "SDG 13", "developing nations", "geology", "environmental impact"],
  "sdg_tags": ["SDG_12", "SDG_13", "SDG_15"],
  "url": "https://www.bgr.bund.de/EN/Themen/Publikationen/Reports/2021/GMB-2021-001.html",
  "pdf_url": "https://www.bgr.bund.de/EN/Themen/Publikationen/Reports/2021/GMB-2021-001.pdf?__blob=publicationFile",
  "pdf_filename": "bgr_mining_governance_2021_sustainability_climate_resilience.pdf",
  "download_date": "2024-11-19T15:30:00Z",
  "related_ids": ["BGR-GMB-2021-001-DE"],
  "quality_checked": true,
  "notes": "High quality evaluation report with policy recommendations for G20 development partnerships. Includes case studies from South Africa, Ghana, Tanzania, Indonesia, and Peru."
}
